{
  "$schema": "https://json-schema.org/draft/2020-12/schema",
  "$id": "snapshot.schema.json",
  "title": "Dashboard snapshot",
  "description": "The aggregates-only snapshot.json that scripts/lanes/snapshot.mjs builds and .github/workflows/dashboard.yml publishes to GitHub Pages (ADR 0012). Numbers, titles, stages, check and reviewer names and times only: no logins, emails, bodies or comments. contracts.test.mjs checks a built snapshot against this file field by field.",
  "type": "object",
  "required": ["version", "generatedAt", "issues", "edges", "overlaps"],
  "additionalProperties": false,
  "properties": {
    "version": { "description": "The snapshot shape's version.", "const": 0 },
    "generatedAt": { "description": "When the snapshot was built, as a UTC ISO 8601 time. The page shows it, since scheduled runs can be late.", "type": "string", "pattern": "^\\d{4}-\\d{2}-\\d{2}T\\d{2}:\\d{2}:\\d{2}(\\.\\d+)?Z$" },
    "issues": {
      "description": "Every open task issue (one with a tier label) and every open issue a pull request closes.",
      "type": "array",
      "items": {
        "type": "object",
        "required": ["number", "title", "tier", "stage", "blockedBy"],
        "additionalProperties": false,
        "properties": {
          "number": { "description": "The issue number.", "type": "integer", "minimum": 1 },
          "title": { "description": "The issue title, control characters removed and cut to 200 characters. GitHub-sourced text: render it as text, never as HTML.", "type": "string", "maxLength": 200 },
          "tier": { "description": "The issue's tier label, or unknown when it has none.", "enum": ["skip", "quick", "full", "unknown"] },
          "stage": {
            "description": "status.mjs's stage vocabulary for an issue with a pull request; ready, blocked, not-ready and already met for one without. running is an open issue with the lane:running label and no pull request yet (ADR 0014).",
            "enum": ["ready", "blocked", "not-ready", "already met", "starting", "failing", "contract", "owner", "gate", "review", "queued", "running"]
          },
          "blockedBy": {
            "description": "What holds the issue or its pull request up. reason is the lanes/gate description verbatim for gate waits.",
            "type": "array",
            "items": {
              "type": "object",
              "required": ["kind", "ref", "reason"],
              "additionalProperties": false,
              "properties": {
                "kind": { "enum": ["issue", "check", "review", "owner", "queue"] },
                "ref": { "description": "An issue as #N, a check or reviewer by name, or the merge queue.", "type": "string", "maxLength": 200 },
                "reason": { "type": "string", "maxLength": 500 }
              }
            }
          },
          "pr": {
            "description": "The open pull request that closes the issue, when there is one.",
            "type": "object",
            "required": ["number", "headSha", "checks"],
            "additionalProperties": false,
            "properties": {
              "number": { "type": "integer", "minimum": 1 },
              "headSha": { "type": "string", "pattern": "^[0-9a-f]{40}$" },
              "checks": {
                "type": "array",
                "items": {
                  "type": "object",
                  "required": ["name", "result"],
                  "additionalProperties": false,
                  "properties": {
                    "name": { "type": "string", "maxLength": 200 },
                    "result": { "enum": ["pass", "fail", "pending"] }
                  }
                }
              }
            }
          },
          "criteria": {
            "description": "Per acceptance criterion, from the reviewers' verdicts on the pull request's current head: fail if any reviewer failed it, else pass if any passed it, else not-applicable.",
            "type": "array",
            "items": {
              "type": "object",
              "required": ["index", "result"],
              "additionalProperties": false,
              "properties": {
                "index": { "description": "1-based, as in the reviewers' verdicts.", "type": "integer", "minimum": 1 },
                "result": { "enum": ["pass", "fail", "not-applicable"] }
              }
            }
          }
        }
      }
    },
    "edges": {
      "description": "Each \"Blocked by\" link between two listed issues: from blocks to.",
      "type": "array",
      "items": {
        "type": "object",
        "required": ["from", "to"],
        "additionalProperties": false,
        "properties": {
          "from": { "type": "integer", "minimum": 1 },
          "to": { "type": "integer", "minimum": 1 }
        }
      }
    },
    "overlaps": {
      "description": "Every pair of open ready or running issues whose Scope paths overlap (soft paths excluded), the check pick.mjs and status.mjs run (ADR 0014). a < b, so a pair appears once; contracts.test.mjs enforces the order, which a schema cannot. No file path is published. Always present, an empty list when nothing overlaps.",
      "type": "array",
      "items": {
        "type": "object",
        "required": ["a", "b"],
        "additionalProperties": false,
        "properties": {
          "a": { "description": "The lower issue number.", "type": "integer", "minimum": 1 },
          "b": { "description": "The higher issue number.", "type": "integer", "minimum": 1 }
        }
      }
    }
  }
}
